{
  "$schema": "../../../labctl/src/schemas/meta.schema.json",
  "schema_version": "1.0.0",
  "id": "postmessage-origin-startswith-bypass",
  "title": "postMessage XSS via startsWith Origin Check",
  "track": "xss",
  "difficulty": "practitioner",
  "estimated_minutes": 40,
  "max_lifetime_minutes": 60,
  "learning_objectives": [
    "Treat a window.postMessage handler as a trust boundary: event.data is attacker-controllable and event.origin is the only thing telling you who sent it",
    "Recognise the classic origin-check flaw: e.origin.startsWith('https://trusted') (or indexOf===0) has no delimiter, so a look-alike host such as trusted.evil.example passes",
    "Exploit a cross-window message: a page on a prefix-matching origin postMessages HTML that the handler writes via innerHTML, running script in the victim's authenticated document",
    "See why the prefix flaw is load-bearing: the LEGIT widget origin (which trivially prefix-matches) sends only fixed safe content, so an attacker payload requires an origin that BOTH reflects it AND passes the check — only a look-alike does both",
    "Understand why the sink must land in the top-level authenticated page (not a cross-site iframe) — a SameSite=Lax cookie is absent in a cross-site frame, so document.cookie there would be empty",
    "Apply the fix: compare e.origin for EXACT equality against an allowlist, and never write message data with innerHTML (use textContent / a strict schema)"
  ],
  "owasp_categories": ["A03:2021-Injection"],
  "cwe_ids": ["CWE-79", "CWE-346"],
  "prerequisites": ["dom-xss-innerhtml-jquery-html"],
  "flag_hint": "The host page reads ?widget= (escaped into the iframe src) and its message handler accepts any origin that startsWith('http://widget-host'). Point ?widget= at http://widget-host-evil:8080/frame?msg=<img src=x onerror=…> — that look-alike origin prefix-matches, so the handler innerHTML's your payload in the top-level page. Steal document.cookie to the collector, read /oob/received, POST /solve {\"c\":\"<32 hex>\"}.",
  "tech_stack": [
    "Python 3.12",
    "Flask 3.1",
    "gunicorn 23",
    "stdlib chat-widget origin, Host-branched (legit widget-host sends fixed safe content; look-alike widget-host-evil reflects msg) as the postMessage sender",
    "@websec-lab/xss-verifier headless-Chromium bot",
    "stdlib OOB collector"
  ],
  "tags": [
    "xss",
    "postmessage",
    "origin-validation",
    "startswith-bypass",
    "cross-window-messaging",
    "innerhtml-sink",
    "cookie-theft",
    "oob-exfil",
    "victim-bot",
    "cwe-79",
    "cwe-346"
  ],
  "risk": "low",
  "authors": ["furkanalp41"],
  "exposed_service": { "container_port": 8080, "protocol": "http", "http_path": "/" },
  "inspired_by": "The canonical postMessage origin-validation bug class (naive startsWith/indexOf/regex origin checks; PortSwigger and Cure53 write-ups), abstracted for local Docker with a Flask host page, a look-alike widget origin via docker network aliases, a Playwright admin bot, and an OOB collector"
}
